{
  "contract_type": "cc-004-development-architecture",
  "contract_name": "Development Architecture",
  "template_file": "cc-004-development-architecture.template.md",
  "version": "1.0.0",
  "validations": {
    "compliance_summary_table": {
      "enabled": true,
      "severity": "BLOCKING",
      "requirement_count": 14,
      "column_validation": {
        "columns": [
          {
            "name": "Code",
            "pattern": "^LADES\\d+$",
            "required": true
          },
          {
            "name": "Requirement",
            "max_length": 120,
            "required": true
          },
          {
            "name": "Category",
            "allowed_values": [
              "Development Architecture",
              "Technology Stack",
              "Development Practices",
              "Code Quality",
              "Testing",
              "CI/CD"
            ],
            "required": true
          },
          {
            "name": "Status",
            "allowed_values": ["Compliant", "Non-Compliant", "Not Applicable", "Unknown"],
            "required": true
          },
          {
            "name": "Source Section",
            "pattern": "^(\\d+\\.\\d+|Not documented)$",
            "required": true
          },
          {
            "name": "Responsible Role",
            "required": true
          }
        ]
      }
    },
    "status_value_standardization": {
      "enabled": true,
      "severity": "BLOCKING",
      "allowed_values": ["Compliant", "Non-Compliant", "Not Applicable", "Unknown"],
      "case_sensitive": true
    },
    "appendix_structure": {
      "enabled": true,
      "severity": "BLOCKING",
      "required_appendices": ["A.1", "A.2", "A.3", "A.4"],
      "strict_order": true
    },
    "forbidden_section_numbering": {
      "enabled": true,
      "severity": "BLOCKING",
      "description": "Sections after A.4 Change History must not be numbered (A.5, A.6, etc.)",
      "pattern": "###\\s+A\\.[5-9]\\d*\\b",
      "error_message": "Found numbered section A.5 or higher. Only A.1-A.4 should be numbered. Shared sections (Data Extracted, Missing Data, Not Applicable, Unknown Status, Generation Metadata) must be H2 (##) without numbering.",
      "fix_instructions": "Remove numbering from shared sections. Change '### A.5 Data Extracted Successfully' to '## Data Extracted Successfully'"
    },
    "document_control_table": {
      "enabled": true,
      "severity": "BLOCKING",
      "required_table_pattern": "\\| Field \\| Value \\|",
      "required_fields": [
        "Document Owner",
        "Last Review Date",
        "Status",
        "Validation Score",
        "Approval Authority"
      ],
      "error_message": "Document Control section must use table format with | Field | Value | structure. Found list format instead of table."
    },
    "compliance_calculation": {
      "enabled": true,
      "severity": "BLOCKING",
      "total_requirements": 14,
      "percentage_tolerance": 0,
      "completeness_tolerance": 1
    },
    "template_completeness": {
      "enabled": true,
      "severity": "BLOCKING",
      "required_sections": [
        "header",
        "document_control",
        "compliance_summary",
        "overall_compliance",
        "appendix_a1_a4",
        "dynamic_sections",
        "questions_gaps_register"
      ]
    }
  },
  "error_messages": {
    "table_row_count_mismatch": "Development Architecture requires exactly 14 requirement rows. Found {actual} rows."
  }
}
