{
  "contract_type": "cc-001-business-continuity",
  "contract_name": "Business Continuity",
  "template_file": "cc-001-business-continuity.template.md",
  "version": "2.0.0",
  "validations": {
    "compliance_summary_table": {
      "enabled": true,
      "severity": "BLOCKING",
      "reason": "Business Continuity v2.0 uses 6-column table format (Code, Requirement, Category, Status, Source Section, Responsible Role)",
      "expected_columns": ["Code", "Requirement", "Category", "Status", "Source Section", "Responsible Role"],
      "minimum_rows": 43
    },
    "section_based_format": {
      "enabled": false,
      "severity": "BLOCKING",
      "note": "Business Continuity v2.0 migrated from section-based to table-based format"
    },
    "status_value_standardization": {
      "enabled": true,
      "severity": "BLOCKING",
      "allowed_values": ["Compliant", "Non-Compliant", "Not Applicable", "Unknown"],
      "case_sensitive": true,
      "common_errors": {
        "compliant": "Compliant",
        "non-compliant": "Non-Compliant",
        "not applicable": "Not Applicable",
        "unknown": "Unknown",
        "N/A": "Not Applicable"
      }
    },
    "appendix_structure": {
      "enabled": true,
      "severity": "BLOCKING",
      "required_appendices": ["A.1", "A.2", "A.3", "A.4"],
      "strict_order": false,
      "note": "Business Continuity v2.0 includes A.2 Source Mapping Table"
    },
    "forbidden_section_numbering": {
      "enabled": true,
      "severity": "BLOCKING",
      "forbidden_patterns": [
        "### A\\.5",
        "### A\\.6",
        "### A\\.7",
        "### A\\.8",
        "### A\\.9"
      ],
      "error_message": "Sections after A.4 must be H2 headers WITHOUT numbering. Found: {pattern}. Correct format: '## Section Name' (not '### A.X Section Name')"
    },
    "document_control_table": {
      "enabled": true,
      "severity": "BLOCKING",
      "required_table_pattern": "\\| Field \\| Value \\|",
      "required_fields": [
        "Document Owner",
        "Last Review Date",
        "Status",
        "Validation Score",
        "Approval Authority"
      ],
      "error_message": "Document Control section must use table format with | Field | Value | structure. Found list format instead of table."
    },
    "compliance_calculation": {
      "enabled": false,
      "severity": "BLOCKING",
      "note": "Business Continuity uses section-based compliance tracking, not Overall Compliance section"
    },
    "template_completeness": {
      "enabled": true,
      "severity": "BLOCKING",
      "required_sections": [
        "header",
        "document_control",
        "compliance_summary_table",
        "detailed_requirements",
        "appendix_a1",
        "appendix_a2",
        "appendix_a3",
        "appendix_a4",
        "dynamic_sections",
        "questions_gaps_register"
      ],
      "minimum_requirements": 43
    }
  },
  "error_messages": {
    "missing_required_section": "Business Continuity contract v2.0 requires: Compliance Summary table (43 LACN codes), Detailed Requirements sections, and Appendices A.1-A.4",
    "insufficient_requirements": "Business Continuity contract v2.0 must include all 43 LACN requirements (LACN001-LACN043)"
  }
}
